{
  "$schema":"https://json-schema.org/draft/2020-12/schema","$id":"https://nexa.local/starbench/project-estimate-brief-v0.1.schema.json","title":"Project Estimate Brief V0.1","type":"object","additionalProperties":false,
  "required":["schema_version","record_type","project_id","project_name","project_goal","product_scope","known_modules","planned_features","existing_assets","legacy_assets","dependencies","technical_constraints","risk_constraints","expected_deliverables","known_task_plan","preferred_models","resource_constraints","pricing_snapshot_ref","entitlement_snapshot_ref","metadata"],
  "properties":{"schema_version":{"const":"0.1"},"record_type":{"const":"PROJECT_ESTIMATE_BRIEF"},"project_id":{"type":["string","null"]},"project_name":{"type":"string","minLength":1},"project_goal":{"type":"string","minLength":1},"product_scope":{"type":"array","items":{"type":"string","minLength":1}},"known_modules":{"type":"array","items":{"type":"string","minLength":1}},"planned_features":{"type":"array","items":{"type":"string","minLength":1}},"existing_assets":{"type":"array","items":{"type":"string","minLength":1}},"legacy_assets":{"type":"array","items":{"type":"string","minLength":1}},"dependencies":{"type":"array","items":{"type":"string","minLength":1}},"technical_constraints":{"type":"array","items":{"type":"string","minLength":1}},"risk_constraints":{"type":"array","items":{"type":"string","minLength":1}},"expected_deliverables":{"type":"array","minItems":1,"items":{"type":"string","minLength":1}},"known_task_plan":{"type":["array","null"],"items":{"$ref":"#/$defs/task"}},"preferred_models":{"type":["array","null"],"items":{"enum":["CHAT_REASONING","CODEX","GENERAL_API_EXECUTOR","OTHER_API_MODEL","SUBSCRIPTION_MODEL"]}},"resource_constraints":{"type":"object"},"pricing_snapshot_ref":{"type":["string","null"]},"entitlement_snapshot_ref":{"type":["string","null"]},"metadata":{"type":"object"}},
  "$defs":{"task":{"type":"object","additionalProperties":false,"required":["task_id","phase","task_type","description","dependencies","expected_output","tests_required","review_required"],"properties":{"task_id":{"type":"string","minLength":1},"phase":{"type":"string","minLength":1},"task_type":{"type":"string","minLength":1},"description":{"type":"string","minLength":1},"dependencies":{"type":"array","items":{"type":"string"}},"expected_output":{"type":"string","minLength":1},"tests_required":{"type":"boolean"},"review_required":{"type":"boolean"}}}}
}
