{
  "schema_version":"0.1","record_type":"PROJECT_ESTIMATE_BRIEF","project_id":"fixture-risk","project_name":"Risk-heavy Compatibility Upgrade","project_goal":"Upgrade a cross-module data workflow without losing Legacy compatibility or violating permissions","product_scope":["data intake","migration","permission-safe processing","compatibility reporting"],"known_modules":["gateway","migration","policy","reporting"],"planned_features":["new intake format","Legacy data migration","permission enforcement","compatibility report"],"existing_assets":["old data contracts","permission policy","regression suite"],"legacy_assets":["Legacy records","Legacy importer mapping","Legacy compatibility rules"],"dependencies":["migration depends on gateway","policy applies across migration and reporting","reporting consumes migrated data"],"technical_constraints":["offline only","no credential material","old and new formats must coexist"],"risk_constraints":["Legacy data migration can fail compatibility checks","cross-module integration may require repair","permission boundary requires audit","failed first construction requires diagnostic analysis"],"expected_deliverables":["migration design","implementation","compatibility tests","permission audit","expanded regression","final report"],"known_task_plan":null,"preferred_models":null,"resource_constraints":{"business_runtime_network":0,"real_api_calls":0,"strict_permission_review":true},"pricing_snapshot_ref":"pricing-fixture-ref","entitlement_snapshot_ref":null,"metadata":{"source_class":"TEST_FIXTURE"}
}
