{
  "schema_version":"0.1","record_type":"PROJECT_ESTIMATE_BRIEF","project_id":"fixture-complex","project_name":"Complex Multi-module Migration","project_goal":"Build a new project estimation workflow across intake, planning, storage, and reporting while preserving Legacy definitions","product_scope":["project intake","semantic planning","history calibration","reporting"],"known_modules":["intake","planner","history","reporting"],"planned_features":["structured brief intake","work graph generation","usage calibration","resource proposal"],"existing_assets":["schema loaders","JSONL store patterns","offline test harness"],"legacy_assets":["legacy task descriptions","historical summary exports"],"dependencies":["planner depends on intake contracts","reporting depends on forecast output","calibrator depends on history intake"],"technical_constraints":["offline runtime","strict provenance","candidate-neutral model classes","backward-compatible contracts"],"risk_constraints":["Legacy migration must preserve provenance","cross-module integration may expand context"],"expected_deliverables":["schemas","runtime modules","stores","fixtures","tests","report"],"known_task_plan":null,"preferred_models":["CHAT_REASONING","CODEX","SUBSCRIPTION_MODEL"],"resource_constraints":{"business_runtime_network":0,"real_api_calls":0,"subscription_tracking":true},"pricing_snapshot_ref":null,"entitlement_snapshot_ref":"entitlement-fixture-ref","metadata":{"source_class":"TEST_FIXTURE"}
}
